Title,Outlet,Date,URL,Description
Could this mysterious California news site influence the 2026 election?,CalMatters / Los Angeles Times,01/05/2026,,Reprinted in Los Angeles Times
Media in Trump's Second Presidency,CQ Researcher Report,09/19/2025,,By Gregory Perreault
The Political Pulse: Why Polling Persists in American Politics,The Politic,01/18/2025,,
San Francisco politics are about to get crazy. Here's what to look out for,The San Francisco Standard,09/02/2024,,
Could These Unconventional Voices Determine the 2024 Election?,Deseret News,08/19/2024,,
Who Cares What Taylor Swift Thinks?,Harvard Gazette,02/08/2024,,
Newspaper Endorsements and the Importance of Candidate Quality in Politics,IQSS Blog,08/14/2023,,
