Title,Status,Authors,Description,Draft
Local News in the Crosshairs: Audience Perceptions of Algorithmic News Sites,Working Paper,DeLuca Kevin; Beavers David A.,,"
Candidate Quality, Incumbency, and Election Outcomes in the United States,APSA Preprint (2023),DeLuca Kevin,,"
The Influence of Biased Local Newspaper Endorsements,APSA Preprint (2023),DeLuca Kevin,"Presented at the 94th Annual Southern Political Science Association Meeting, January 2023. Honorable Mention for the Pi Sigma Alpha – Malcolm Jewell Award","
Optimal Media Bias for Political Accountability,In Progress,DeLuca Kevin,,"
Reading Between the Headlines: Candidate Coverage and Electoral Accountability in Presidential Elections,In Progress,DeLuca Kevin; Kava Zoe,,"
Reverse Media Capture: Editorial Blackmail and the Newspaper Preservation Act of 1970,In Progress,DeLuca Kevin; Beingessner Andrew; Legoretta Marina,,"
Publicity-as-Lobbying: Newsies Little Merchants and Newspapers Fight for Labor Exemptions,In Progress,DeLuca Kevin,,"
The Decline of Evening Newspapers: Partisan Slants Impact on Election Results,In Progress,DeLuca Kevin; Simko Tyler; Snyder Jr. James M.; Song B.K.,,"
